{
  "schema_version": "dsvire.retrieval-preregistration.v1",
  "plan_id": "dsvire-colsmol-egvv-cycle-v5@2026-09-17",
  "parent_issue": "https://github.com/TokitoAI/tokito/issues/440",
  "tracking_issue": "https://github.com/TokitoAI/tokito-dsvire/issues/114",
  "sealed_before": ["source_download", "content_hashing", "page_rendering", "region_annotation", "query_authoring", "model_scoring"],
  "families": [
    {"id":"ti-bq24075","split":"calibration","manufacturer":"Texas Instruments","category":"usb_battery_charger","datasheet_identity":"BQ24075 SLUS810","selected_mpn":"BQ24075","selected_package":"QFN-16","official_source_url":"https://www.ti.com/lit/ds/symlink/bq24075.pdf"},
    {"id":"nxp-pca9538","split":"calibration","manufacturer":"NXP Semiconductors","category":"octal_i2c_gpio","datasheet_identity":"PCA9538","selected_mpn":"PCA9538","selected_package":"TSSOP-16","official_source_url":"https://www.nxp.com/docs/en/data-sheet/PCA9538.pdf"},
    {"id":"ti-tlv9062","split":"calibration","manufacturer":"Texas Instruments","category":"cmos_operational_amplifier","datasheet_identity":"TLV9062 SBOS839","selected_mpn":"TLV9062","selected_package":"VSSOP-8","official_source_url":"https://www.ti.com/lit/ds/symlink/tlv9062.pdf"},
    {"id":"nxp-tja1057","split":"calibration","manufacturer":"NXP Semiconductors","category":"high_speed_can_transceiver","datasheet_identity":"TJA1057","selected_mpn":"TJA1057","selected_package":"SOIC-8","official_source_url":"https://www.nxp.com/docs/en/data-sheet/TJA1057.pdf"},
    {"id":"ti-txb0104","split":"calibration","manufacturer":"Texas Instruments","category":"bidirectional_level_translator","datasheet_identity":"TXB0104 SCEM129","selected_mpn":"TXB0104","selected_package":"TSSOP-14","official_source_url":"https://www.ti.com/lit/ds/symlink/txb0104.pdf"},
    {"id":"nxp-fxls8974cf","split":"calibration","manufacturer":"NXP Semiconductors","category":"3_axis_accelerometer","datasheet_identity":"FXLS8974CF","selected_mpn":"FXLS8974CF","selected_package":"DFN-10","official_source_url":"https://www.nxp.com/docs/en/data-sheet/FXLS8974CF.pdf"},
    {"id":"ti-tps61023","split":"evaluation","manufacturer":"Texas Instruments","category":"synchronous_boost_converter","datasheet_identity":"TPS61023 SLVSFR5","selected_mpn":"TPS61023","selected_package":"SOT-563","official_source_url":"https://www.ti.com/lit/ds/symlink/tps61023.pdf"},
    {"id":"nxp-pca9517","split":"evaluation","manufacturer":"NXP Semiconductors","category":"i2c_bus_repeater","datasheet_identity":"PCA9517","selected_mpn":"PCA9517","selected_package":"TSSOP-8","official_source_url":"https://www.nxp.com/docs/en/data-sheet/PCA9517.pdf"},
    {"id":"ti-am26c31","split":"evaluation","manufacturer":"Texas Instruments","category":"rs422_line_driver","datasheet_identity":"AM26C31 SLLS103","selected_mpn":"AM26C31","selected_package":"SOIC-16","official_source_url":"https://www.ti.com/lit/ds/symlink/am26c31.pdf"},
    {"id":"nxp-nts0304e","split":"evaluation","manufacturer":"NXP Semiconductors","category":"dual_supply_level_translator","datasheet_identity":"NTS0304E","selected_mpn":"NTS0304E","selected_package":"TSSOP-14","official_source_url":"https://www.nxp.com/docs/en/data-sheet/NTS0304E.pdf"},
    {"id":"ti-sn65hvd3082e","split":"evaluation","manufacturer":"Texas Instruments","category":"rs485_transceiver","datasheet_identity":"SN65HVD3082E SLLS539","selected_mpn":"SN65HVD3082E","selected_package":"SOIC-8","official_source_url":"https://www.ti.com/lit/ds/symlink/sn65hvd3082e.pdf"},
    {"id":"nxp-pca9536","split":"evaluation","manufacturer":"NXP Semiconductors","category":"quad_i2c_gpio","datasheet_identity":"PCA9536","selected_mpn":"PCA9536","selected_package":"SOIC-8","official_source_url":"https://www.nxp.com/docs/en/data-sheet/PCA9536.pdf"}
  ],
  "acquisition": {
    "availability_preflight": "all exact URLs were streamed through strict PDF parsing and bounded identity/orderable-package text checks on 2026-09-17; bodies were immediately deleted and no hash, render, region, annotation, query, or score was retained. Cycle v4 remains frozen; MMA8451Q was not replaced in that plan.",
    "allowed_redirects": 5,
    "maximum_pdf_bytes": 67108864,
    "require_pdf_magic": true,
    "require_declared_identity_in_bounded_text": true,
    "on_unavailable_or_mismatched_source": "invalidate_family_without_replacement",
    "post_seal_artifact": "dsvire.retrieval-cycle-source-manifest.v1 with final URL, bytes, and SHA-256"
  },
  "annotation": {
    "region_types": ["pinout", "table", "package"],
    "required_positive_regions_per_family": 3,
    "required_hard_negative_kinds": ["wrong_intent", "wrong_package", "wrong_variant", "wrong_view"],
    "minimum_hard_negatives_per_family": 4,
    "review_protocol": "two-pass blinded review; author and independent human adjudicator cannot inspect model scores",
    "agent_audit_policy": "agent audit may reject unsafe crops before independent review but cannot satisfy independent-review acceptance",
    "disagreements": "adjudicate before query encoding; unresolved regions are excluded and recorded"
  },
  "queries": {
    "authoring": "manual natural-language prompts written after region adjudication and before model scoring",
    "intents": ["pinout", "table", "package"],
    "queries_per_intent_per_family": 2,
    "minimum_total": 72,
    "review_protocol": "independent human reviewer checks intent, exact identity, relevance, and hard-negative links without model scores",
    "prohibited": ["template-only queries", "model-generated queries", "post-score edits", "labels or case IDs in query text"]
  },
  "candidate_universe": {"crop_ranking":"every adjudicated region in the selected split for every query","full_page_baseline":"every rendered page in the selected split for every query","unannotated_figures":"not silently counted as negatives; record judgment incompleteness separately","maxsim_k":32},
  "systems": {"candidate":"pinned ColSmol crop BM25+dense/RRF+MaxSim cascade plus a separately calibrated EGVV decision layer","comparators":["same pinned ColSmol over naive full pages","pinned unscoped OpenCLIP over crops","unscoped BM25 text-RAG over crop text"]},
  "metrics": ["nDCG@5", "R@5", "mAP", "MRR", "coverage", "hard-negative-at-5", "wrong-figure acceptance", "Brier score", "ECE", "query p95", "pages/s/GPU", "compressed pack bytes"],
  "frozen_gate": {"evaluation_queries_minimum":36,"coverage_minimum":1.0,"crop_recall_at_5_vs_full_page_minimum_delta":-0.01,"crop_recall_at_5_vs_openclip_minimum_delta":0.15,"crop_recall_at_5_vs_text_rag_minimum_delta":0.15,"verified_wrong_figure_rate_maximum":0.02,"target_gpu_hot_query_p95_ms_maximum":800,"crop_index_pages_per_second_per_gpu_minimum":2.0,"compressed_crop_pack_vs_full_page_ratio_maximum":0.15,"all_conditions_required":true},
  "execution_order": ["merge this pre-registration unchanged","acquire and hash official sources into a separate immutable manifest","annotate calibration and evaluation without model scores","obtain independent review and seal annotations before score access","author and independently review queries without model scores","run calibration systems and freeze the candidate and EGVV policy","run evaluation systems exactly once","publish passing or failing compact evidence without retuning"],
  "invalidation": ["family/source identity mismatch or unavailable official source","family overlap with any previously consumed or pre-registered cycle","score access before annotation and query review are sealed","threshold, metric, comparator, split, or query mutation after this plan merges","substitution of unofficial mirror bytes","agent audit represented as independent human review","tuning on evaluation outcomes"],
  "publication_policy": "automated catalog publication remains disabled unless this exact held-out gate passes, an independently reviewed calibrated EGVV contract is emitted, and the deterministic publication contract passes"
}
